{
  "$comment": "Linked variations (HANDOFF §5.4). progressions: easiest first; each step's easier and harder neighbours are the steps beside it. equipment: the same move with other equipment (no order). An exercise may be in several. Research and sources: docs/progressions.md.",
  "progressions": [
    {"name": "Push-up", "steps": ["bw-wall-pushup", "chair-incline-pushup", "bench-incline-pushup", "bw-knee-pushup", "bw-pushup", "bench-decline-pushup"]},
    {"name": "Squat", "steps": ["chair-mini-squat", "chair-sit-to-stand", "bw-squat", "bw-jump-squat"]},
    {"name": "Single-leg squat", "steps": ["bw-split-squat", "bw-reverse-lunge", "bw-walking-lunge", "bench-bulgarian-split-squat", "bw-pistol-squat"]},
    {"name": "Plank", "steps": ["core-knee-plank", "core-forearm-plank", "bench-feet-up-plank"]},
    {"name": "Glute bridge", "steps": ["bw-glute-bridge", "chair-heel-bridge", "bw-single-leg-glute-bridge"]},
    {"name": "Calf raise", "steps": ["calf-raise", "step-calf-raise", "calf-raise-single"]},
    {"name": "Sit-up", "steps": ["core-crunch", "core-sit-up", "core-v-up"]},
    {"name": "Pull-up", "steps": ["bar-dead-hang", "bar-chin-up", "bar-pull-up"]},
    {"name": "Roll-Up", "steps": ["pil-half-roll-back", "band-roll-up", "pil-roll-up"]},
    {"name": "Standing balance", "steps": ["bal-tandem-stance", "bal-single-leg-stand"]},
    {"name": "Balance walk", "steps": ["bal-heel-to-toe-walk", "bal-balance-walk"]},
    {"name": "Handstand", "steps": ["wall-handstand", "yoga-handstand"]},
    {"name": "Headstand", "steps": ["wall-headstand", "yoga-headstand"]},
    {"name": "Forearm Stand", "steps": ["wall-forearm-stand", "yoga-forearm-balance"]},
    {"name": "Tree Pose", "steps": ["wall-tree", "yoga-tree"]},
    {"name": "Warrior III", "steps": ["wall-warrior-3", "yoga-warrior-3"]},
    {"name": "Downward Dog", "steps": ["wall-downward-dog", "yoga-downward-dog"]},
    {"name": "Triangle Pose", "steps": ["yoga-triangle-block", "yoga-triangle"]},
    {"name": "Half Moon Pose", "steps": ["yoga-half-moon-block", "yoga-half-moon"]},
    {"name": "Pyramid Pose", "steps": ["yoga-pyramid-blocks", "yoga-pyramid"]},
    {"name": "Seated Forward Bend", "steps": ["yoga-seated-forward-bend-strap", "yoga-seated-forward-bend"]},
    {"name": "Bound Angle Forward Bend", "steps": ["yoga-bound-angle-forward-bend-block", "yoga-bound-angle-forward-bend"]},
    {"name": "Warrior I", "steps": ["chair-yoga-warrior-1", "yoga-warrior-1"]},
    {"name": "Warrior II", "steps": ["chair-yoga-warrior-2", "yoga-warrior-2"]},
    {"name": "Eagle Pose", "steps": ["chair-yoga-eagle", "yoga-eagle"]},
    {"name": "Pigeon Pose", "steps": ["chair-yoga-pigeon", "yoga-pigeon"]},
    {"name": "Cat-Cow", "steps": ["chair-yoga-cat-cow", "yoga-cat-cow"]},
    {"name": "Mountain Pose", "steps": ["chair-yoga-mountain", "yoga-mountain"]}
  ],
  "equipment": [
    {"name": "Squat", "ids": ["bw-squat", "bhf-squat", "fw-db-squat", "fw-kb-goblet-squat", "fw-bb-squat"]},
    {"name": "Goblet squat", "ids": ["fw-goblet-squat", "fw-kb-goblet-squat"]},
    {"name": "Reverse lunge", "ids": ["bw-reverse-lunge", "fw-db-reverse-lunge", "kb-goblet-reverse-lunge", "fw-bb-reverse-lunge"]},
    {"name": "Step-up", "ids": ["step-up", "fw-db-step-up", "bench-step-up"]},
    {"name": "Sit-to-stand", "ids": ["chair-sit-to-stand", "fw-db-sit-to-stand"]},
    {"name": "Wall sit", "ids": ["bw-wall-sit", "fw-db-wall-sit", "band-wall-sit-pull-apart"]},
    {"name": "Calf raise", "ids": ["calf-raise", "chair-calf-raise", "fw-db-calf-raise"]},
    {"name": "Single-leg calf raise", "ids": ["calf-raise-single", "fw-db-calf-raise-single"]},
    {"name": "Glute bridge", "ids": ["bw-glute-bridge", "band-glute-bridge", "fw-db-glute-bridge"]},
    {"name": "Hip thrust", "ids": ["bench-hip-thrust", "fw-bb-hip-thrust"]},
    {"name": "Standing kickback", "ids": ["bw-leg-extension", "band-standing-kickback"]},
    {"name": "Deadlift", "ids": ["fw-bb-deadlift", "fw-db-deadlift", "fw-kb-deadlift"]},
    {"name": "Romanian deadlift", "ids": ["band-rdl", "fw-db-rdl", "kb-romanian-deadlift", "fw-bb-rdl"]},
    {"name": "Swing", "ids": ["fw-kb-swing", "fw-db-swing"]},
    {"name": "Clean", "ids": ["kb-clean", "fw-db-clean"]},
    {"name": "Turkish get-up", "ids": ["bw-get-up", "fw-db-turkish-get-up", "kb-turkish-get-up"]},
    {"name": "Bent-over row", "ids": ["band-bent-over-row", "fw-db-row", "fw-bb-row"]},
    {"name": "Upright row", "ids": ["band-upright-row", "fw-db-upright-row", "fw-bb-upright-row"]},
    {"name": "Overhead press", "ids": ["band-overhead-press", "fw-db-press", "kb-overhead-press", "fw-bb-press"]},
    {"name": "Front raise", "ids": ["band-front-raise", "fw-db-front-raise"]},
    {"name": "Lateral raise", "ids": ["bhf-lateral-raise", "fw-db-lateral"]},
    {"name": "Biceps curl", "ids": ["bhf-bicep-curl", "fw-db-curl", "fw-bb-curl"]},
    {"name": "Overhead triceps extension", "ids": ["band-overhead-triceps", "fw-db-overhead-triceps"]},
    {"name": "Triceps kickback", "ids": ["band-triceps-kickback", "fw-db-kickback"]},
    {"name": "Dip", "ids": ["chair-dip", "bench-dip"]},
    {"name": "Crunch", "ids": ["core-crunch", "ball-crunch", "fw-db-weighted-crunch"]},
    {"name": "Leg raise", "ids": ["core-leg-raise", "bench-leg-raise"]},
    {"name": "Dead bug", "ids": ["core-dead-bug", "band-dead-bug", "fw-db-dead-bug"]},
    {"name": "Bird dog", "ids": ["core-bird-dog", "band-bird-dog"]},
    {"name": "Clamshell", "ids": ["side-clamshell", "band-clamshell"]},
    {"name": "Russian twist", "ids": ["core-russian-twist", "kb-russian-twist", "mb-russian-twist"]},
    {"name": "Woodchop", "ids": ["band-woodchop", "fw-db-woodchop", "mb-woodchop"]},
    {"name": "Around the world", "ids": ["kb-around-the-world", "mb-around-the-world"]},
    {"name": "V-up pass", "ids": ["ball-pass", "mb-v-up-pass"]},
    {"name": "Hamstring curl", "ids": ["ball-hamstring-curl", "towel-hamstring-curl"]},
    {"name": "Hundred", "ids": ["pil-hundred", "band-hundred"]},
    {"name": "Leg circles", "ids": ["pil-leg-circles", "band-leg-circles"]},
    {"name": "Seated march", "ids": ["standing-march", "chair-hip-marching", "ball-seated-march"]},
    {"name": "Hip circles", "ids": ["wu-hip-circles", "chair-hip-circles"]},
    {"name": "Hamstring stretch", "ids": ["seated-hamstring-stretch", "mayo-hamstring", "towel-hamstring-stretch", "yoga-reclining-hand-to-big-toe", "chair-hamstring-stretch"]},
    {"name": "Calf stretch", "ids": ["mayo-calf", "towel-calf-stretch", "step-calf-stretch"]},
    {"name": "Quad stretch", "ids": ["mayo-quadriceps", "chair-quad-stretch", "towel-quad-stretch"]},
    {"name": "Hip flexor stretch", "ids": ["mayo-hip-flexor", "chair-hip-flexor-stretch"]},
    {"name": "Chest stretch", "ids": ["wall-chest-stretch", "chair-chest-stretch", "towel-chest-stretch"]}
  ],
  "notLinked": [
    {"ids": ["bw-glute-bridge", "yoga-bridge"], "why": "Bridge Pose is the yoga pose held; the Glute Bridge is lifted and lowered for reps."},
    {"ids": ["band-glute-bridge", "yoga-bridge"], "why": "Bridge Pose is the yoga pose held; the banded bridge is lifted and lowered for reps."},
    {"ids": ["bar-dead-hang", "bar-hanging-knee-raise"], "why": "Both hang from the bar, but the knee raise is a core exercise, not a harder hang."},
    {"ids": ["bw-mountain-climber", "pil-leg-pull-front"], "why": "Both start in a plank; running the knees in is cardio, lifting a straight leg is Pilates control."}
  ]
}
